word,kind,en,ru
"abject","ok","They lived in abject poverty for years.","Они годами жили в унизительной нищете."
"abject","alt_ok","His apology was an abject admission of guilt.","Его извинение было жалким признанием вины."
"abject","bad","They lived in abjact poverty.","«Abjact». (ошибка)"
"adamant","ok","She remained adamant in her decision.","Она осталась непреклонной в своём решении."
"adamant","alt_ok","He was adamant that the plan would work.","Он твёрдо настаивал, что план сработает."
"adamant","bad","She remained adament in her decision.","«Adament». (ошибка)"
"adroit","ok","He gave an adroit response under pressure.","Он дал ловкий ответ под давлением."
"adroit","alt_ok","Her adroit handling of the crisis impressed everyone.","Её искусное руководство в кризис впечатлило всех."
"adroit","bad","He gave an adroite response.","«Adroite». (ошибка)"
"affluent","ok","They grew up in an affluent neighborhood.","Они выросли в зажиточном районе."
"affluent","alt_ok","An affluent client funded the project.","Богатый клиент профинансировал проект."
"affluent","bad","They grew up in an affuent neighborhood.","«Affuent». (ошибка)"
"altruistic","ok","Her altruistic efforts helped many families.","Её альтруистичные усилия помогли многим семьям."
"altruistic","alt_ok","He made an altruistic donation.","Он сделал альтруистичное пожертвование."
"altruistic","bad","Her altruisic efforts helped many.","«Altruisic». (ошибка)"
"amenable","ok","He is amenable to reasonable suggestions.","Он податлив к разумным предложениям."
"amenable","alt_ok","The data were amenable to analysis.","Данные поддавались анализу."
"amenable","bad","He is ameanable to suggestions.","«Ameanable». (ошибка)"
"austere","ok","The room had an austere design.","Комната была оформлена строго."
"austere","alt_ok","She led an austere lifestyle.","Она вела аскетичный образ жизни."
"austere","bad","The room had an austier design.","«Austier». (ошибка)"
"brazen","ok","It was a brazen attempt to cheat.","Это была наглая попытка жульничества."
"brazen","alt_ok","He made a brazen demand for money.","Он сделал бесстыдное требование денег."
"brazen","bad","It was a brazzen attempt to cheat.","«Brazzen». (ошибка)"
"candid","ok","She gave a candid interview.","Она дала откровенное интервью."
"candid","alt_ok","Let’s have a candid discussion.","Давайте поговорим откровенно."
"candid","bad","She gave a candit interview.","«Candit». (ошибка)"
"capricious","ok","Markets can be capricious and unpredictable.","Рынки могут быть капризными и непредсказуемыми."
"capricious","alt_ok","His capricious mood annoyed colleagues.","Его переменчивое настроение раздражало коллег."
"capricious","bad","Markets can be capricous.","«Capricous». (ошибка)"
"clandestine","ok","They held a clandestine meeting at night.","Они провели тайную встречу ночью."
"clandestine","alt_ok","A clandestine network operated in the city.","В городе действовала подпольная сеть."
"clandestine","bad","They held a clandistine meeting.","«Clandistine». (ошибка)"
"complacent","ok","He became complacent after early success.","После раннего успеха он стал самодовольным."
"complacent","alt_ok","Complacent attitudes hinder progress.","Самодовольные настроения мешают прогрессу."
"complacent","bad","He became complascent after success.","«Complascent». (ошибка)"
"conciliatory","ok","She adopted a conciliatory tone.","Она перешла на примирительный тон."
"conciliatory","alt_ok","They issued a conciliatory statement.","Они выпустили примирительное заявление."
"conciliatory","bad","She adopted a concilatory tone.","«Concilatory». (ошибка)"
"conspicuous","ok","The error was conspicuous to everyone.","Ошибка была заметна всем."
"conspicuous","alt_ok","He wore a conspicuous red hat.","Он надел бросающуюся в глаза красную шляпу."
"conspicuous","bad","The error was conspicous to everyone.","«Conspicous». (ошибка)"
"contemptuous","ok","He gave a contemptuous glance.","Он бросил презрительный взгляд."
"contemptuous","alt_ok","Her contemptuous tone offended them.","Её презрительный тон обидел их."
"contemptuous","bad","He gave a contempteous glance.","«Contempt eous». (ошибка)"
"copious","ok","She took copious notes during the lecture.","На лекции она делала обильные записи."
"copious","alt_ok","Copious rainfall caused flooding.","Обильные дожди вызвали наводнение."
"copious","bad","She took copieus notes.","«Copieus». (ошибка)"
"cryptic","ok","He left a cryptic message.","Он оставил загадочное сообщение."
"cryptic","alt_ok","Her reply was brief and cryptic.","Её ответ был коротким и загадочным."
"cryptic","bad","He left a crypthic message.","«Crypthic». (ошибка)"
"cursory","ok","He gave a cursory glance at the report.","Он бегло взглянул на отчёт."
"cursory","alt_ok","A cursory review revealed mistakes.","Поверхностная проверка выявила ошибки."
"cursory","bad","He gave a cursary glance.","«Cursary». (ошибка)"
"decadent","ok","The party had a decadent atmosphere.","На вечеринке царила упадочная атмосфера."
"decadent","alt_ok","A decadent dessert was served.","Подали изысканный, «упадочный» десерт."
"decadent","bad","The party had a decandent atmosphere.","«Decandent». (ошибка)"
"definitive","ok","This is the definitive guide on the topic.","Это окончательное руководство по теме."
"definitive","alt_ok","They reached a definitive agreement.","Они достигли окончательного соглашения."
"definitive","bad","This is the defenitive guide.","«Defenitive». (ошибка)"
"deleterious","ok","Smoking has deleterious effects.","Курение оказывает пагубные эффекты."
"deleterious","alt_ok","A deleterious substance leaked into the river.","В реку просочилось вредное вещество."
"deleterious","bad","Smoking has deliterious effects.","«Deliterious». (ошибка)"
"derisive","ok","He made a derisive comment.","Он сделал насмешливое замечание."
"derisive","alt_ok","Derisive laughter filled the room.","Комната наполнилась издевательским смехом."
"derisive","bad","He made a derisivee comment.","«Derisivee». (ошибка)"
"despondent","ok","She felt despondent after the news.","После новости она была подавленной."
"despondent","alt_ok","He grew despondent over repeated failures.","Он отчаялся из-за повторных провалов."
"despondent","bad","She felt despondant after the news.","«Despondant». (ошибка)"
"didactic","ok","The novel has a didactic tone.","Роман имеет поучительный тон."
"didactic","alt_ok","His lecture was overly didactic.","Его лекция была чрезмерно назидательной."
"didactic","bad","The novel has a didactik tone.","«Didactik». (ошибка)"
"discerning","ok","A discerning reader will notice the nuance.","Проницательный читатель заметит нюанс."
"discerning","alt_ok","She has a discerning eye for detail.","У неё проницательный глаз на детали."
"discerning","bad","A discernig reader will notice it.","«Discernig». (ошибка)"
"disingenuous","ok","His apology seemed disingenuous.","Его извинение казалось неискренним."
"disingenuous","alt_ok","A disingenuous remark undermined trust.","Неискреннее замечание подорвало доверие."
"disingenuous","bad","His apology seemed disingenuos.","«Disingenuos». (ошибка)"
"disparate","ok","They compared disparate data sets.","Они сравнили разнородные наборы данных."
"disparate","alt_ok","Disparate groups formed a coalition.","Разнородные группы образовали коалицию."
"disparate","bad","They compared disparrate data sets.","«Disparrate». (ошибка)"
"dogged","ok","Her dogged determination paid off.","Ее упорная решимость окупилась."
"dogged","alt_ok","He pursued the goal with dogged focus.","Он преследовал цель с упорной сосредоточенностью."
"dogged","bad","Her doged determination paid off.","«Doged». (ошибка)"
"dubious","ok","The claim sounds dubious at best.","Это утверждение в лучшем случае сомнительно."
"dubious","alt_ok","He gave a dubious explanation.","Он дал сомнительное объяснение."
"dubious","bad","The claim sounds dubios.","«Dubios». (ошибка)"
"egregious","ok","It was an egregious error.","Это была вопиющая ошибка."
"egregious","alt_ok","Egregious misconduct led to dismissal.","Вопиющее нарушение привело к увольнению."
"egregious","bad","It was an egregous error.","«Egregous». (ошибка)"
"elusive","ok","The solution remained elusive.","Решение оставалось неуловимым."
"elusive","alt_ok","An elusive concept is hard to define.","Неуловимую концепцию трудно определить."
"elusive","bad","The solution remained elussive.","«Elussive». (ошибка)"
"eminent","ok","An eminent scholar joined the panel.","К панели присоединился выдающийся учёный."
"eminent","alt_ok","She is eminent in her field.","Она выдающаяся в своей области."
"eminent","bad","An eminant scholar joined the panel.","«Eminant». (ошибка)"
"emphatic","ok","He gave an emphatic denial.","Он дал решительный отказ."
"emphatic","alt_ok","Her emphatic tone ended the debate.","Её решительный тон прекратил спор."
"emphatic","bad","He gave an emphat ic denial.","«Emphat ic». (ошибка)"
"enigmatic","ok","She gave an enigmatic smile.","Она улыбнулась загадочно."
"enigmatic","alt_ok","An enigmatic message arrived at midnight.","Загадочное сообщение пришло в полночь."
"enigmatic","bad","She gave an enygmatic smile.","«Enygmatic». (ошибка)"
"equitable","ok","We need an equitable solution for all.","Нам нужно справедливое решение для всех."
"equitable","alt_ok","The policy is equitable and transparent.","Политика справедлива и прозрачна."
"equitable","bad","We need an equitible solution.","«Equitible». (ошибка)"
"erratic","ok","Her progress was erratic at first.","Сначала её прогресс был неустойчивым."
"erratic","alt_ok","Erratic behavior worried the team.","Нестабильное поведение обеспокоило команду."
"erratic","bad","Her progress was eratic at first.","«Eratic». (ошибка)"
"esoteric","ok","The paper uses esoteric terminology.","Статья использует узкоспециальную терминологию."
"esoteric","alt_ok","An esoteric debate followed.","Затем последовала эзотерическая дискуссия."
"esoteric","bad","The paper uses esot eric terms.","«Esot eric». (ошибка)"
"exorbitant","ok","The hotel charges were exorbitant.","Тарифы отеля были непомерными."
"exorbitant","alt_ok","Exorbitant fees deter customers.","Чрезмерные сборы отпугивают клиентов."
"exorbitant","bad","The charges were exhorbitant.","«Exhorbitant». (ошибка)"
"expedient","ok","It was expedient to postpone the vote.","Целесообразно было отложить голосование."
"expedient","alt_ok","An expedient compromise was reached.","Был достигнут выгодный компромисс."
"expedient","bad","It was expediant to postpone it.","«Expediant». (ошибка)"
"fastidious","ok","He is fastidious about details.","Он щепетилен к деталям."
"fastidious","alt_ok","A fastidious editor spotted every flaw.","Щепетильный редактор заметил каждый изъян."
"fastidious","bad","He is fastidous about details.","«Fastidous». (ошибка)"
"fervent","ok","She is a fervent supporter of reform.","Она ярая сторонница реформ."
"fervent","alt_ok","Fervent prayers filled the hall.","Пылкие молитвы наполнили зал."
"fervent","bad","She is a fer vent supporter.","«Fer vent». (ошибка)"
"flagrant","ok","A flagrant violation occurred.","Произошло вопиющее нарушение."
"flagrant","alt_ok","Flagrant errors were ignored.","Вопиющие ошибки проигнорировали."
"flagrant","bad","A flagr ant violation occurred.","«Flagr ant». (ошибка)"
"formidable","ok","They faced a formidable challenge.","Они столкнулись с грозным вызовом."
"formidable","alt_ok","A formidable opponent entered the race.","В гонку вступил сильный соперник."
"formidable","bad","They faced a formiddable challenge.","«Formiddable». (ошибка)"
"frivolous","ok","He filed a frivolous complaint.","Он подал легкомысленную жалобу."
"frivolous","alt_ok","Frivolous spending drained the budget.","Легкомысленные траты истощили бюджет."
"frivolous","bad","He filed a frivolus complaint.","«Frivolus». (ошибка)"
"furtive","ok","He cast a furtive glance around.","Он бросил скрытный взгляд по сторонам."
"furtive","alt_ok","A furtive movement caught my eye.","Скрытное движение бросилось мне в глаза."
"furtive","bad","He cast a fur tive glance.","«Fur tive». (ошибка)"
"futile","ok","Their efforts proved futile.","Их усилия оказались тщетными."
"futile","alt_ok","A futile attempt wasted resources.","Тщетная попытка растратила ресурсы."
"futile","bad","Their efforts proved futyle.","«Futyle». (ошибка)"
"haphazard","ok","Books lay in a haphazard pile.","Книги лежали беспорядочной кучей."
"haphazard","alt_ok","Work progressed in a haphazard manner.","Работа продвигалась бессистемно."
"haphazard","bad","Books lay in a haphaz ard pile.","«Haphaz ard». (ошибка)"
"heinous","ok","It was a heinous crime.","Это было чудовищное преступление."
"heinous","alt_ok","He was jailed for heinous acts.","Его посадили за отвратительные деяния."
"heinous","bad","It was a henious crime.","«Henious». (ошибка)"
"holistic","ok","We took a holistic approach to health.","Мы подошли к здоровью комплексно."
"holistic","alt_ok","A holistic view can reveal patterns.","Целостный взгляд может выявить закономерности."
"holistic","bad","We took a holistik approach.","«Holistik». (ошибка)"
"idiosyncratic","ok","Her idiosyncratic style is unique.","Её своеобразный стиль уникален."
"idiosyncratic","alt_ok","An idiosyncratic solution emerged.","Появилось нестандартное решение."
"idiosyncratic","bad","Her idiosincratic style is unique.","«Idiosincratic». (ошибка)"
"illicit","ok","They traded in illicit goods.","Они торговали незаконными товарами."
"illicit","alt_ok","Illicit activities were exposed.","Незаконная деятельность была раскрыта."
"illicit","bad","They traded in ilicit goods.","«Ilicit». (ошибка)"
"immaterial","ok","The difference is immaterial to the outcome.","Разница несущественна для результата."
"immaterial","alt_ok","Those details are immaterial here.","Эти детали здесь несущественны."
"immaterial","bad","The difference is imaterial.","«Imaterial». (ошибка)"
"impervious","ok","He is impervious to criticism.","Он невосприимчив к критике."
"impervious","alt_ok","The coat is impervious to rain.","Плащ не пропускает дождь."
"impervious","bad","He is impervius to criticism.","«Impervius». (ошибка)"
"implicit","ok","The threat was implicit, not stated.","Угроза была неявной, не озвученной."
"implicit","alt_ok","Implicit bias affects decisions.","Неявная предвзятость влияет на решения."
"implicit","bad","The threat was implisit.","«Implisit». (ошибка)"
"imprudent","ok","It would be imprudent to invest now.","Сейчас было бы неблагоразумно инвестировать."
"imprudent","alt_ok","An imprudent remark cost him support.","Неосторожное замечание стоило ему поддержки."
"imprudent","bad","It would be imprundent to invest.","«Imprundent». (ошибка)"
"incisive","ok","She offered an incisive analysis.","Она предложила меткий анализ."
"incisive","alt_ok","His incisive questions cut to the core.","Его острые вопросы попадали в самую суть."
"incisive","bad","She offered an insisive analysis.","«Insisive». (ошибка)"
"incongruous","ok","The joke felt incongruous at a funeral.","Шутка была неуместной на похоронах."
"incongruous","alt_ok","Incongruous colors clashed on the wall.","Несочетающиеся цвета конфликтовали на стене."
"incongruous","bad","The joke felt incongrous.","«Incongrous». (ошибка)"
"indelible","ok","The trip left an indelible memory.","Поездка оставила неизгладимое впечатление."
"indelible","alt_ok","Ink made an indelible mark.","Чернила оставили несмываемый след."
"indelible","bad","It left an indelib le mark.","«Indelib le». (ошибка)"
"indispensable","ok","Trust is indispensable in our work.","Доверие незаменимо в нашей работе."
"indispensable","alt_ok","She is an indispensable member of the team.","Она незаменимый член команды."
"indispensable","bad","Trust is indespensable here.","«Indespensable». (ошибка)"
"inexorable","ok","The advance of time is inexorable.","Ход времени неумолим."
"inexorable","alt_ok","Inexorable pressure mounted.","Неумолимое давление нарастало."
"inexorable","bad","The advance of time is inexor able.","«Inexor able». (ошибка)"




